{
  "$schema": "../../schemas/plugin.schema.json",
  "name": "horse",
  "version": "1.0.0",
  "title": "Horse",
  "description": "Reference plugin: a layered horse assembled from photoreal coats on a shared silhouette.",
  "license": "MIT",
  "canvas": {
    "width": 1024,
    "height": 1024,
    "background": "#00000000"
  },
  "layers": [
    {
      "id": "body",
      "title": "Build",
      "order": 10,
      "required": true,
      "options": [
        {
          "id": "standard",
          "title": "Standard-OC",
          "asset": "layers/body/standard.png"
        },
        {
          "id": "foal",
          "title": "Foal",
          "asset": "layers/body/foal.png"
        },
        {
          "id": "lusitano",
          "title": "Lusitanien",
          "asset": "layers/body/lusitano.png"
        },
        {
          "id": "arabian",
          "title": "Arabe",
          "asset": "layers/body/arabian.png"
        }
      ]
    },
    {
      "id": "coat",
      "title": "Coat",
      "order": 20,
      "required": true,
      "dependsOn": ["body"],
      "opacity": 1,
      "blendMode": "normal",
      "options": [
        {
          "id": "bay",
          "title": "Bay",
          "asset": "layers/coat/bay.png",
          "tags": ["dark"]
        },
        {
          "id": "bay-brun",
          "title": "Bay-brun",
          "asset": "layers/coat/bay-brun.png",
          "tags": ["dark"]
        },
        {
          "id": "black",
          "title": "Black",
          "asset": "layers/coat/black.png",
          "tags": ["dark"]
        },
        {
          "id": "chestnut",
          "title": "Chestnut",
          "asset": "layers/coat/chestnut.png"
        },
        {
          "id": "grey",
          "title": "Grey",
          "asset": "layers/coat/grey.png",
          "tags": ["light"]
        },
        {
          "id": "roan",
          "title": "Roan",
          "asset": "layers/coat/roan.png",
          "tags": ["dark"]
        },
        {
          "id": "palomino",
          "title": "Palomino",
          "asset": "layers/coat/palomino.png",
          "tags": ["light"]
        },
        {
          "id": "isabelle",
          "title": "Isabelle",
          "asset": "layers/coat/isabelle.png",
          "tags": ["light"]
        },
        {
          "id": "cream",
          "title": "Cream",
          "asset": "layers/coat/cream.png",
          "tags": ["light"]
        }
      ]
    },
    {
      "id": "coat-foal",
      "title": "Coat",
      "order": 20,
      "required": true,
      "dependsOn": ["body"],
      "opacity": 1,
      "blendMode": "normal",
      "options": [
        {
          "id": "bay",
          "title": "Bay",
          "asset": "layers/coat-foal/bay.png",
          "tags": ["dark"]
        },
        {
          "id": "bay-brun",
          "title": "Bay-brun",
          "asset": "layers/coat-foal/bay-brun.png",
          "tags": ["dark"]
        },
        {
          "id": "black",
          "title": "Black",
          "asset": "layers/coat-foal/black.png",
          "tags": ["dark"]
        },
        {
          "id": "chestnut",
          "title": "Chestnut",
          "asset": "layers/coat-foal/chestnut.png"
        },
        {
          "id": "grey",
          "title": "Grey",
          "asset": "layers/coat-foal/grey.png",
          "tags": ["light"]
        },
        {
          "id": "roan",
          "title": "Roan",
          "asset": "layers/coat-foal/roan.png",
          "tags": ["dark"]
        },
        {
          "id": "palomino",
          "title": "Palomino",
          "asset": "layers/coat-foal/palomino.png",
          "tags": ["light"]
        },
        {
          "id": "isabelle",
          "title": "Isabelle",
          "asset": "layers/coat-foal/isabelle.png",
          "tags": ["light"]
        },
        {
          "id": "cream",
          "title": "Cream",
          "asset": "layers/coat-foal/cream.png",
          "tags": ["light"]
        }
      ]
    },
    {
      "id": "coat-lusitano",
      "title": "Coat",
      "order": 20,
      "required": true,
      "dependsOn": ["body"],
      "opacity": 1,
      "blendMode": "normal",
      "options": [
        {
          "id": "bay",
          "title": "Bay",
          "asset": "layers/coat-lusitano/bay.png",
          "tags": ["dark"]
        },
        {
          "id": "bay-brun",
          "title": "Bay-brun",
          "asset": "layers/coat-lusitano/bay-brun.png",
          "tags": ["dark"]
        },
        {
          "id": "black",
          "title": "Black",
          "asset": "layers/coat-lusitano/black.png",
          "tags": ["dark"]
        },
        {
          "id": "chestnut",
          "title": "Chestnut",
          "asset": "layers/coat-lusitano/chestnut.png"
        },
        {
          "id": "grey",
          "title": "Grey",
          "asset": "layers/coat-lusitano/grey.png",
          "tags": ["light"]
        },
        {
          "id": "roan",
          "title": "Roan",
          "asset": "layers/coat-lusitano/roan.png",
          "tags": ["dark"]
        },
        {
          "id": "palomino",
          "title": "Palomino",
          "asset": "layers/coat-lusitano/palomino.png",
          "tags": ["light"]
        },
        {
          "id": "isabelle",
          "title": "Isabelle",
          "asset": "layers/coat-lusitano/isabelle.png",
          "tags": ["light"]
        },
        {
          "id": "cream",
          "title": "Cream",
          "asset": "layers/coat-lusitano/cream.png",
          "tags": ["light"]
        }
      ]
    },
    {
      "id": "coat-arabian",
      "title": "Coat",
      "order": 20,
      "required": true,
      "dependsOn": ["body"],
      "opacity": 1,
      "blendMode": "normal",
      "options": [
        {
          "id": "bay",
          "title": "Bay",
          "asset": "layers/coat-arabian/bay.png",
          "tags": ["dark"]
        },
        {
          "id": "bay-brun",
          "title": "Bay-brun",
          "asset": "layers/coat-arabian/bay-brun.png",
          "tags": ["dark"]
        },
        {
          "id": "black",
          "title": "Black",
          "asset": "layers/coat-arabian/black.png",
          "tags": ["dark"]
        },
        {
          "id": "chestnut",
          "title": "Chestnut",
          "asset": "layers/coat-arabian/chestnut.png"
        },
        {
          "id": "grey",
          "title": "Grey",
          "asset": "layers/coat-arabian/grey.png",
          "tags": ["light"]
        },
        {
          "id": "roan",
          "title": "Roan",
          "asset": "layers/coat-arabian/roan.png",
          "tags": ["dark"]
        },
        {
          "id": "isabelle",
          "title": "Isabelle",
          "asset": "layers/coat-arabian/isabelle.png",
          "tags": ["light"]
        }
      ]
    },
    {
      "id": "pie",
      "title": "Pie",
      "order": 25,
      "dependsOn": ["coat"],
      "opacity": 1,
      "blendMode": "normal",
      "options": [
        {
          "id": "tobiano",
          "title": "Tobiano",
          "asset": "layers/pie/tobiano.png"
        },
        {
          "id": "tovero",
          "title": "Tovero",
          "asset": "layers/pie/tovero.png"
        },
        {
          "id": "overo",
          "title": "Overo",
          "asset": "layers/pie/overo.png"
        },
        {
          "id": "splashed-white",
          "title": "Splashed white",
          "asset": "layers/pie/splashed-white.png"
        },
        {
          "id": "sabino",
          "title": "Sabino",
          "asset": "layers/pie/sabino.png"
        }
      ]
    },
    {
      "id": "pie-foal",
      "title": "Pie",
      "order": 25,
      "dependsOn": ["coat-foal"],
      "opacity": 1,
      "blendMode": "normal",
      "options": [
        {
          "id": "tobiano",
          "title": "Tobiano",
          "asset": "layers/pie-foal/tobiano.png"
        },
        {
          "id": "tovero",
          "title": "Tovero",
          "asset": "layers/pie-foal/tovero.png"
        },
        {
          "id": "overo",
          "title": "Overo",
          "asset": "layers/pie-foal/overo.png"
        },
        {
          "id": "splashed-white",
          "title": "Splashed white",
          "asset": "layers/pie-foal/splashed-white.png"
        },
        {
          "id": "sabino",
          "title": "Sabino",
          "asset": "layers/pie-foal/sabino.png"
        }
      ]
    },
    {
      "id": "markings",
      "title": "Face markings",
      "order": 30,
      "dependsOn": ["coat", "pie"],
      "options": [
        {
          "id": "blaze",
          "title": "Blaze (liste)",
          "asset": "layers/markings/Standard-OC/blaze.png"
        },
        {
          "id": "thin-blaze",
          "title": "Thin blaze (fine liste)",
          "asset": "layers/markings/Standard-OC/thin-blaze.png"
        },
        {
          "id": "stripe",
          "title": "Stripe (race)",
          "asset": "layers/markings/Standard-OC/stripe.png"
        },
        {
          "id": "star",
          "title": "Star (étoile)",
          "asset": "layers/markings/Standard-OC/star.png"
        },
        {
          "id": "diamond",
          "title": "Diamond (lozange)",
          "asset": "layers/markings/Standard-OC/diamond.png"
        },
        {
          "id": "heart",
          "title": "Heart (cœur)",
          "asset": "layers/markings/Standard-OC/heart.png"
        },
        {
          "id": "snip",
          "title": "Snip (pelote)",
          "asset": "layers/markings/Standard-OC/snip.png"
        },
        {
          "id": "star-snip",
          "title": "Star and snip",
          "asset": "layers/markings/Standard-OC/star-snip.png"
        },
        {
          "id": "bald",
          "title": "Bald face (grosse liste)",
          "asset": "layers/markings/Standard-OC/bald.png"
        },
        {